{
  "$schema": "http://json-schema.org/draft-07/schema#",
  "title": "Subclass",
  "type": "object",
  "required": ["name", "parentClass", "features"],
  "properties": {
    "id": { "type": "string" },
    "name": { "type": "string" },
    "parentClass": { "type": "string", "description": "must match a class name/id" },
    "source": { "type": "string", "default": "5e SRD" },
    "flavor": { "type": "string" },
    "features": {
      "type": "array",
      "items": {
        "type": "object",
        "required": ["level", "name", "description"],
        "properties": {
          "level": { "type": "integer", "minimum": 1, "maximum": 20 },
          "name": { "type": "string" },
          "description": { "type": "string" },
          "role": {
            "type": "string",
            "enum": ["combat", "roleplay"],
            "description": "What the feature is for. Omitted = combat. COMPOSITION RULE: every subclass has exactly 3 features — 2 combat + 1 roleplay (for dialogue, exploration, improvised attempts). Acrobat disciplines are the sanctioned 4-feature exception (their L5 reaction feature)."
          },
          "narration": {
            "type": "string",
            "description": "The IN-PLAY tab: how this looks, sounds, and is performed at the table when it happens mid-fight \u2014 the swing, the dodge, the wire going taut, what the crowd sees. Pure fiction, ZERO numbers: never restate a die, a DC, a range, a cost, or a condition name here (those live in the mechanics tab). 2-4 sentences. Written second person, present tense."
          },
          "sheetSummary": {
            "type": "string",
            "description": "REQUIRED EVENTUALLY on every feature (backfill before character creation ships). The condensed text shown on a player's character sheet: ONLY what it does — effect, damage + type, conditions applied, cost/uses. Cut all flavor and all 'why/how the class performs it' prose. Features with `options` keep their full options table on the sheet regardless (Wild Card and the like are pertinent info)."
          },
          "meta": {
            "type": "object",
            "description": "At-a-glance combat fields shown as labelled chips below the feature (D&D Beyond style). All optional.",
            "properties": {
              "action": { "type": "string" },
              "cost": { "type": "string" },
              "uses": { "type": "string" },
              "range": { "type": "string" },
              "save": { "type": "string" }
            }
          },
          "options": {
            "type": "array",
            "description": "For a feature that offers a menu of choices or a random table. The renderer shows these as a table; `description` holds the intro text. Author any multi-option feature this way rather than cramming the options into prose.",
            "items": {
              "type": "object",
              "required": ["name", "effect"],
              "properties": {
                "roll": { "type": ["integer", "string"], "description": "Optional die result for a random table. Omit for a pick-one menu." },
                "name": { "type": "string", "description": "Short name of the option/result." },
                "effect": { "type": "string", "description": "What it does. May contain [[XdY]] scaling-die tokens." }
              }
            }
          }
        }
      }
    }
  }
}
