{
  "id": "ringleader",
  "name": "Ringleader",
  "parentClass": "jester",
  "source": "Circus of Chaos",
  "flavor": "Somebody has to run the show. It was never going to be the strongman. The Ringleader is the Jester who moves everyone else around the stage — the buff-and-debuff discipline, and the only one that never deals damage at all.",
  "features": [
    {
      "level": 3,
      "name": "Cue the Next Act",
      "role": "combat",
      "description": "As a bonus action, choose one ally you can see within 30 feet. It may immediately use its reaction to move up to half its speed without provoking opportunity attacks. You can do this once per combat, and again each time you spend Mirth on a Prestige.",
      "sheetSummary": "Bonus action, 30 ft, once per combat (and again whenever you cast a Prestige). One ally may immediately use its reaction to move up to half its speed without provoking opportunity attacks.",
      "narration": "You call it like a cue, because it is one — a name, a gesture, a stamp of the foot — and they are moving before they have decided to.",
      "meta": {
        "action": "Bonus Action",
        "uses": "1 / combat",
        "range": "30 ft"
      }
    },
    {
      "level": 3,
      "name": "Everyone Watch This",
      "role": "combat",
      "description": "You point, and one of your people takes the shot. Once on each of your turns, when you cast a Turn that affects one or more enemies, choose one ally you can see within 30 feet: that ally has advantage on its next attack roll against one of those enemies, made before the start of your next turn. **One ally, one attack** — you are handing a single person an opening, not calling the whole company down on one target.",
      "sheetSummary": "1/turn. When you cast a Turn affecting one or more enemies, ONE ally of your choice within 30 ft has advantage on its next attack roll against one of those enemies, before the start of your next turn.",
      "narration": "You call it like a cue and half the room looks where you are pointing — including the one person you actually meant it for, who is already moving.",
      "meta": {
        "action": "Passive",
        "uses": "1 / turn",
        "range": "30 ft"
      }
    },
    {
      "level": 3,
      "name": "Top of the Bill",
      "role": "roleplay",
      "description": "You can run a room the way you run a ring. Given 10 minutes, you can organise any crowd of up to fifty ordinary people into doing one simple coordinated thing — clearing a square, forming a line, all looking the other way, moving somewhere together. They will not fight for you and they will not risk their lives, but they will follow a confident person with a plan, and you are always the most confident person present.",
      "sheetSummary": "Given 10 minutes, organise up to fifty ordinary people into one simple coordinated action (clear a space, form a line, look away, move together). They will not fight or risk their lives for you.",
      "narration": "You get up on something, you raise your voice into its carrying register, and a frightened mob becomes an audience with a job. It is the same skill as calling an act. It has never once failed to work.",
      "meta": {
        "action": "10 minutes",
        "range": "Up to 50 people"
      }
    }
  ]
}
