{
  "id": "mirror",
  "name": "Mirror",
  "parentClass": "doppelganger",
  "source": "Circus System",
  "flavor": "The discipline of the counter-strike: a Doppelganger who turns every shattered reflection and every last-second sidestep into consequence for the creature that struck first.",
  "features": [
    {
      "level": 3,
      "name": "Shattering Reflection",
      "role": "combat",
      "description": "Your Clones don't break quietly. Whenever a creature destroys one of your Clones with an attack roll (including a Clone destroyed by an attack redirected onto it via Mirror Image, but never a Clone you destroy yourself through one of your own features), that creature must make a Dexterity saving throw against your {{save DC|8 + proficiency bonus + Constitution modifier}}. On a failed save, it takes [[1d6+Con]] psychic damage as shards of the shattered illusion rake across it, and it has disadvantage on the next attack roll it makes before the end of its next turn. On a successful save, it takes half as much damage and suffers no other effect. This triggers at most once per turn (no matter how many Clones are destroyed that turn) and requires no action or reaction from you to resolve.",
      "narration": "Your reflections do not break quietly. Whoever strikes one down is standing far too close when it goes — a hard bright spray of edges, all of them briefly showing that creature its own face, and then not.",
      "sheetSummary": "When a creature destroys one of your Clones with an attack roll (never a Clone you destroy yourself), it makes a Dexterity save vs your {{save DC|8 + proficiency bonus + Constitution modifier}}. Fail: [[1d6+Con]] psychic and disadvantage on its next attack roll before the end of its next turn. Success: half damage only.",
      "meta": {
        "action": "Passive (auto)",
        "uses": "1 / turn",
        "save": "Dex save vs {{save DC|8 + proficiency bonus + Constitution modifier}}"
      }
    },
    {
      "level": 3,
      "name": "Vanishing Trick",
      "role": "combat",
      "description": "Your Swap doubles as a parting insult, and in a pinch as an escape. It does two separate things:",
      "narration": "You are gone before the space you left has finished being empty, and the thing nearest it commits to a lunge at nothing. On the occasions you leave it later than that, you trade places with the blow already falling and let the reflection catch what was yours.",
      "sheetSummary": "Two separate effects, listed below: a rider on your Swap, and a defensive Swap.",
      "meta": {
        "action": "Free with Swap / Reaction (defensive)",
        "uses": "Disadv 1 / turn; defensive Swap 1 / combat",
        "range": "5 ft / Swap range"
      },
      "options": [
        {
          "name": "Parting insult (1/turn, free)",
          "effect": "When you use Swap, choose one creature within 5 feet of the space you just left that could see you there: it has disadvantage on the next attack roll it makes before the end of your next turn. This costs no action or reaction beyond the Swap itself."
        },
        {
          "name": "Defensive Swap (1/combat, reaction)",
          "effect": "When a creature you can see hits you with an attack, before its damage is dealt, use your reaction to Swap with one of your Clones within Swap's range. You trade places, the blow lands on the Clone now standing where you were and destroys it, and you take no damage."
        }
      ]
    },
    {
      "level": 3,
      "name": "Flawless Forgery",
      "role": "roleplay",
      "description": "A reflection doesn't have to stay in the glass. As an action, you can create a mirror-copy of a Small or smaller nonmagical object you have held within the last minute. The copy is identical to close inspection but is all surface: it shatters into harmless light if it takes any damage, and dissolves on its own after 1 hour. A forged key opens nothing and a forged coin won't survive a bite test — but for a swap, a con, or a decoy on a cushion, it is perfect. There is no limit on how often you do this — you can maintain **one** forgery at a time, and making a new one crumbles the old.",
      "narration": "A reflection does not have to stay in the glass. You lift a copy of something you were holding a moment ago — perfect down to the wear on the handle, flawless right up until anybody treats it like a real object.",
      "sheetSummary": "At will, 1 hour, one forgery at a time. Create a mirror-copy of a Small or smaller nonmagical object you held in the last minute: perfect to inspection, shatters on any damage.",
      "meta": {
        "action": "Action",
        "uses": "At will, one at a time",
        "range": "Self"
      }
    }
  ]
}
