{
  "id": "juggernaut",
  "name": "Juggernaut",
  "parentClass": "the-sandow",
  "source": "Circus System",
  "flavor": "The offense discipline: a Sandow who never stops moving forward, turning every hit, shove, and thrown body into fuel for the next, bigger swing.",
  "features": [
    {
      "level": 3,
      "name": "Unstoppable Force",
      "role": "combat",
      "description": "You feed on the wreckage you cause. In addition to your baseline Grit generation, you gain 1 additional Grit the first time each turn you deal damage to a creature with a Heave throw, and you gain 1 Grit the first time each turn you knock a creature prone by some means OTHER than a Heave (a shove, Bulldozer Charge, Earthshaker, and the like) — two separate sources, each capped at once per turn, exactly like your baseline Grit generation. A Heave already pays out through the first source, so the prone it also causes never grants a second Grit off the same throw. The bigger the mess you make, the more you have left to make it worse.",
      "narration": "Wreckage agrees with you. Every body you throw, every thing you put on its back, feeds the next one — you do not tire across a fight, you accumulate.",
      "sheetSummary": "Passive. On top of baseline Grit: +1 Grit the first time each turn you damage a creature with a Heave throw, and +1 Grit the first time each turn you knock a creature prone by any means other than a Heave. Two sources, each once per turn; a Heave never pays both.",
      "meta": {
        "action": "Passive"
      }
    },
    {
      "level": 3,
      "name": "Bulldozer Charge",
      "role": "combat",
      "description": "When you move at least 15 feet in a straight line toward a creature and then hit it with a melee weapon attack before the end of the same turn, the attack deals an extra [[1d6]] bludgeoning damage, and the target must succeed on a Strength saving throw against your {{save DC|8 + proficiency bonus + Strength modifier}} or be knocked prone and pushed 5 feet directly away from you, your choice of direction. You can use Bulldozer Charge only once per turn.",
      "narration": "You do not close the distance so much as delete it. Fifteen feet of straight-line acceleration arrives all at once, and whatever it arrives at goes over backwards and slides.",
      "sheetSummary": "1/turn. After moving at least 15 ft in a straight line toward a creature and hitting it with a melee weapon attack: extra [[1d6]] bludgeoning, and a Strength save vs your {{save DC|8 + proficiency bonus + Strength modifier}} or knocked prone and pushed 5 ft away.",
      "meta": {
        "action": "Part of Attack",
        "uses": "1 / turn",
        "range": "Melee",
        "save": "Str save vs {{save DC|8 + proficiency bonus + Strength modifier}}"
      }
    },
    {
      "level": 3,
      "name": "Through, Not Around",
      "role": "roleplay",
      "description": "Doors are a suggestion and walls are a delay. You have advantage on Strength checks made to break, force, or topple objects and barriers, and your attacks deal double damage to objects and structures. Given a minute of uninterrupted battering, you can break through any nonmagical door, palisade, or barricade that a creature of your size could conceivably breach — the only question the table needs to answer is how much noise you make doing it.",
      "narration": "Doors are a suggestion. Walls are a delay. You have never once looked for the way around something, and given a minute of uninterrupted effort there usually stops being a something.",
      "sheetSummary": "Advantage on Strength checks to break/force objects and barriers; double damage vs objects and structures. Given 1 minute, breach any breachable nonmagical door or barricade.",
      "meta": {
        "action": "Passive"
      }
    }
  ]
}
