{
  "id": "fatemonger",
  "name": "Fatemonger",
  "parentClass": "jester",
  "source": "Circus of Chaos",
  "flavor": "Luck is a resource like any other. It belongs to whoever is paying attention, and nobody in this company pays attention like you. The Fatemonger is the Jester who makes misfortune land on someone — the damage discipline of a class that otherwise buffs and mends.",
  "features": [
    {
      "level": 3,
      "name": "Loaded Odds",
      "role": "combat",
      "description": "You do not let a bad roll stand. When an ally you can see within 30 feet rolls a 1 on a d20 for an attack roll, ability check, or saving throw, you can make them reroll it for free — no action, once on each of your turns. Separately, once on each of your turns you can spend 1 Mirth to make an ally within 30 feet reroll ANY d20 they just rolled, whatever the number was. Either way they must use the new result.",
      "sheetSummary": "Free, 1/turn: an ally who rolls a 1 on a d20 rerolls it. Also 1/turn, for 1 Mirth: an ally rerolls ANY d20 they just rolled. They must use the new result.",
      "narration": "You tut, or click your tongue, or simply look at them — and the moment gets a second go at itself. Nobody has ever been able to explain how you do it, least of all you.",
      "meta": {
        "action": "No action",
        "cost": "Free on a 1, else 1 Mirth",
        "uses": "1 / turn each",
        "range": "30 ft"
      }
    },
    {
      "level": 3,
      "name": "The House Always Collects",
      "role": "combat",
      "description": "Fortune runs both ways at your table, and you take a cut of every swing of it. You gain 1 Mirth whenever a creature you can see within 30 feet rolls a natural 20 or a natural 1 on an attack roll — the disaster and the miracle are both material, and you were watching either way.",
      "sheetSummary": "Gain 1 Mirth whenever a creature you can see within 30 ft rolls a natural 20 or a natural 1 on an attack roll.",
      "narration": "The worst possible thing happens and you laugh first, because a disaster is just a setup with better timing, and you have already worked out what it is setting up.",
      "meta": {
        "action": "Passive",
        "range": "30 ft"
      }
    },
    {
      "level": 3,
      "name": "Never Pays to Bet Against Him",
      "role": "roleplay",
      "description": "You have an unnatural nose for a wager. You know instinctively whether a game of chance, a contract, or an offer put to you is rigged, though not how. When you make a bet, a bargain, or a wager of any kind and lose, you may declare that you meant to — you recover whatever you staked, and everyone present remembers it as a joke you were making.",
      "sheetSummary": "You instinctively know whether a game, contract, or offer is rigged, but not how. When you lose a bet or bargain, declare you meant to: you recover your stake and everyone remembers it as a joke. The same crowd never falls for it twice.",
      "narration": "You lose spectacularly, take a bow for it, and by the time the laugh dies down the money is back in your hand and nobody can reconstruct how the bet was ever serious.",
      "meta": {
        "action": "Passive",
        "uses": "No limit; the same crowd only once"
      }
    }
  ]
}
