{
  "id": "tightrope",
  "name": "Tightrope",
  "parentClass": "acrobat",
  "source": "Circus System",
  "flavor": "The precision discipline: a performer who has spent so long balanced on a single strand of wire high above the crowd that solid ground feels generous, and every strike lands exactly where it was always going to.",
  "features": [
    {
      "level": 3,
      "name": "Perfect Balance",
      "role": "combat",
      "description": "You ignore the effects of narrow, unstable, or slippery surfaces: you can move across a tightrope, ledge, ice, rubble, or similar footing at your full speed, without needing an ability check, and you don't fall from such a surface. Additionally, you have advantage on saving throws and ability checks made to avoid being knocked prone or moved against your will. From 5th level, that unshakeable footing becomes an answer. When a creature within 5 feet of you misses you with an attack roll, you can use your reaction to make one melee weapon attack against it. Like all your weapon attacks (see Improved Critical), this scores a critical hit on a 19 or 20, and on a hit you throw the target off its line: it has disadvantage on the next attack roll it makes before the start of your next turn. This is distinct from your base Riposte, which triggers on a clean Full Dodge and spends Momentum at no reaction cost; this one punishes any miss and costs your reaction. It uses the same single reaction as Parry, so landing both a Parry and this counter in one round relies on Flowing Reflexes (3rd level) returning your reaction after a successful Parry.",
      "narration": "Ledges, ice, rubble, a rope over a drop — none of it registers as difficult; you simply walk it at speed while everyone else picks their way. And when a strike comes in and misses, your footing was never the thing in question, so you answer from exactly where you were standing.",
      "sheetSummary": "Ignore narrow, unstable, or slippery footing: full speed, no check, no falling from it. Advantage on saves and checks against being knocked prone or moved against your will. From 5th level, when a creature within 5 ft misses you, use your reaction to make one melee weapon attack against it (critting on 19-20 via Improved Critical); on a hit it has disadvantage on its next attack roll before the start of your next turn. Uses the same single reaction as Parry.",
      "meta": {
        "action": "Passive"
      }
    },
    {
      "level": 3,
      "name": "Improved Critical",
      "role": "combat",
      "description": "Your weapon attacks score a critical hit on a roll of 19 or 20. Whenever you score a critical hit, you regain 1 Momentum (no more than once per turn, and never above your current cap).",
      "narration": "You have an eye for the seam — the gap in the plate, the place the guard is thin — and you find it far more often than the odds say you should. Every time you do, it feeds the rhythm.",
      "sheetSummary": "Your weapon attacks crit on a 19 or 20. On a crit, regain 1 Momentum, no more than once per turn and never above your cap.",
      "meta": {
        "action": "Passive"
      }
    },
    {
      "level": 3,
      "name": "Wire-Walker's Poise",
      "role": "roleplay",
      "description": "Years above the crowd have calibrated your eye and your nerve. You can judge any distance, height, drop, or gap you can see to within a foot, just by looking. You have advantage on Charisma (Performance) checks that showcase balance or precision, and you can carry one willing Medium or smaller creature across a narrow or unstable surface without slowing or risking either of you.",
      "narration": "Years spent above a crowd have calibrated your eye. You can look at a gap, a drop, a span, and simply know it — no pacing it out, no guessing — and you can carry someone across a wire without either of you wobbling, which they will talk about for a long time afterwards.",
      "sheetSummary": "Judge any visible distance/height/drop exactly by eye. Advantage on balance/precision Performance checks. Carry one willing Medium or smaller creature across narrow surfaces safely at full speed.",
      "meta": {
        "action": "Passive"
      }
    }
  ]
}
