{
  "id": "swarm",
  "name": "Swarm",
  "parentClass": "doppelganger",
  "source": "Circus System",
  "flavor": "The discipline of overwhelming numbers: a Doppelganger who stops treating a Clone as one spare body and starts fielding a crowd, letting sheer duplication wear a target down from every angle at once.",
  "features": [
    {
      "level": 3,
      "name": "Overflowing Reflections",
      "role": "combat",
      "description": "Your reflections multiply more readily than most. Your Clone cap increases by 1 (this stacks with the increase Hall of Mirrors grants at 5th level). Additionally, once per combat, when you use your bonus action to create a Clone, you may create a second Clone at the same time, provided doing so would not exceed your (increased) Clone cap; both appear following the normal rules for Clone creation, in unoccupied spaces you can see within range.",
      "narration": "They come faster than they should. You leave one behind and there are somehow two of them standing there, both wearing the expression you had a second ago.",
      "sheetSummary": "Clone cap +1, stacking with Hall of Mirrors. Once per combat, when you create a Clone with your bonus action, create a second at the same time if that stays within your cap.",
      "meta": {
        "action": "Passive",
        "uses": "2nd Clone: 1 / combat"
      }
    },
    {
      "level": 3,
      "name": "Overwhelming Numbers",
      "role": "combat",
      "description": "You press your numbers from every angle at once — and then take the legs out. Once per turn, when you hit a creature with a weapon attack while one of your Clones is within 5 feet of it, two things happen: you deal an extra [[1d4]] damage of the weapon's damage type as the creature flinches from a second angle it can't track, and the Clone sweeps in at the same instant, forcing the target to succeed on a Constitution saving throw against your {{save DC|8 + proficiency bonus + Constitution modifier}} or be knocked prone. Both happen at most once per turn no matter how many Clones are adjacent, and this combines with the advantage granted by Flanking Reflection.",
      "narration": "They cannot cover every angle because there are more angles than there are of them. You come in from one side while a reflection takes the legs from the other, and the ground arrives before they have worked out which of you did it.",
      "sheetSummary": "When you hit a creature with a weapon attack while one of your Clones is within 5 ft of it: extra [[1d4]] damage of the weapon's type, and a Constitution save vs your {{save DC|8 + proficiency bonus + Constitution modifier}} or knocked prone. Once per turn however many Clones are adjacent; stacks with Flanking Reflection's advantage.",
      "meta": {
        "action": "Passive",
        "uses": "1 / turn",
        "range": "5 ft",
        "save": "Con save vs your DC (or prone)"
      }
    },
    {
      "level": 3,
      "name": "One-Man Crowd",
      "role": "roleplay",
      "description": "Why blend into a crowd when you can bring your own? Outside combat, your Clones can wear faces that aren't yours — distinct strangers rather than copies — and can mill about within 60 feet of you: enough to fake a gathering, an entourage, a queue, or a very busy alibi. You have advantage on ability checks made to blend into, start, or read a crowd, and you know instantly when one of your Clones is destroyed, and where it was.",
      "narration": "Why blend into a crowd when you can bring one? Your reflections wear faces that were never yours, mill about, take up space, and hold a conversation with each other while you do the actual work.",
      "sheetSummary": "Out of combat, Clones can look like distinct strangers and mill within 60 ft (fake crowds, entourages, alibis). Advantage on checks to blend into/start/read crowds. Know instantly when and where a Clone is destroyed.",
      "meta": {
        "action": "Passive",
        "range": "60 ft"
      }
    }
  ]
}
