{
  "id": "nightmare",
  "name": "Nightmare",
  "parentClass": "illusionist",
  "source": "Circus of Chaos",
  "flavor": "The illusions that stop being entertainment. You do not show them a monster — you show them the one they already had.",
  "features": [
    {
      "level": 3,
      "name": "It Gets Worse",
      "role": "combat",
      "description": "You find the crack in one mind and keep working it. When a creature fails a saving throw against one of your tricks, you can make it your **Subject** — no action required. While a creature is your Subject it makes **every** saving throw against your tricks with disadvantage, for as long as the fight lasts. You can have only one Subject at a time: naming a new one releases the old immediately, and your Subject is released when combat ends. This deliberately never applies to more than one creature at once — the table has exactly one name to remember, however many enemies are in the room.",
      "sheetSummary": "No action, when a creature fails a save against one of your tricks: it becomes your Subject. Your Subject makes EVERY save against your tricks with disadvantage for the rest of the combat. Only one Subject at a time — naming a new one releases the old, and it ends when combat does.",
      "narration": "You watched what went through them the first time and you simply do not let it go. Every trick you throw at them after that lands on ground you already broke, and they can feel you choosing them.",
      "meta": {
        "action": "No action (on a failed save)",
        "uses": "One Subject at a time",
        "range": "Any of your tricks"
      }
    },
    {
      "level": 3,
      "name": "Feed the Fear",
      "role": "combat",
      "description": "This discipline adds two tricks to your list, free and permanent: **Your Own Face** (level 2) and **Night Terrors** (level 3). They are yours alone — no other Illusionist learns them. Terror is credibility. The first time each turn a creature fails a saving throw against one of your tricks that deals psychic damage, you gain 1 additional Phantasm, over and above whatever your engine already granted this turn.",
      "sheetSummary": "Adds Your Own Face (L2) and Night Terrors (L3) to your trick list. 1/turn. Gain 1 additional Phantasm the first time each turn a creature fails a save against one of your psychic-damage tricks.",
      "narration": "You watch it land and something in you banks it. The scream is not the point. The scream is the receipt.",
      "meta": {
        "action": "Passive",
        "uses": "1 / turn"
      }
    },
    {
      "level": 3,
      "name": "Reader of Rooms",
      "role": "roleplay",
      "description": "You have spent your career finding the thing an audience is most afraid of and selling it back to them. After a minute of watching or talking to a creature, you learn what it fears most — a person, a memory, a manner of dying, a specific humiliation — as a single clear impression. The creature does not know you have done this. A creature that cannot be frightened yields nothing.",
      "sheetSummary": "After 1 minute observing or talking to a creature, learn what it fears most as a single clear impression. It doesn't notice. Creatures immune to fear yield nothing.",
      "narration": "You are not reading minds. You are reading a face across a minute of small talk, the way you have read ten thousand faces from a stage, and by the end of it you know exactly which thing to put in front of them.",
      "meta": {
        "action": "1 minute",
        "range": "Sight/conversation"
      }
    }
  ]
}
