{
  "id": "hypnotist",
  "name": "Hypnotist",
  "parentClass": "illusionist",
  "source": "Circus of Chaos",
  "flavor": "You do not need them to see anything. You need them to agree with you, and people agree with far more than they think they do. The Hypnotist is the Illusionist who works on the mind directly — and the only one who adds tricks to his own list.",
  "features": [
    {
      "level": 3,
      "name": "Suggestion Under the Patter",
      "role": "combat",
      "description": "You never stop talking, and none of it sounds like an order. Once on each of your turns, as a bonus action, choose one creature within 30 feet that can hear and understand you. It must succeed on a Wisdom saving throw against your {{trick save DC|8 + proficiency bonus + Intelligence modifier}} or, on its next turn, it cannot willingly move closer to you and cannot target you with an attack. It may act freely otherwise — this never takes its turn away, it only takes YOU off the list of things it is willing to do something about. This costs nothing and has no daily limit: keeping one creature off you is simply what a Hypnotist does with his bonus action.",
      "sheetSummary": "No cost. Target must hear and understand you. Wisdom save vs {{trick save DC|8 + proficiency bonus + Intelligence modifier}} or on its next turn it can't willingly move closer to you and can't target you with an attack. It acts freely otherwise.",
      "narration": "You keep talking. Nothing you say is an order and none of it sounds like magic, and somewhere in the middle of it the thing decides, entirely on its own, that you are not who it wants to be dealing with.",
      "meta": {
        "action": "Bonus Action",
        "uses": "1 / turn",
        "range": "30 ft",
        "save": "Wis save vs {{trick save DC|8 + proficiency bonus + Intelligence modifier}}"
      }
    },
    {
      "level": 3,
      "name": "Sympathetic Response",
      "role": "combat",
      "description": "This discipline adds two Mesmerism tricks to your list, free and permanent: **Lull** (level 2) and **The Suggestion** (level 3). They are yours alone — no other Illusionist learns them — and they are what this feature is built on, because the base Illusionist list carries almost no Mesmerism at all. On top of that, a mind you have opened stays open: when a creature fails a saving throw against one of your Mesmerism tricks, it has **disadvantage on every attack roll and every saving throw it makes until the end of its next turn**. It is not helpless and nobody gets a free shot at it — it is simply worse at all of it, for a while, because part of it is still listening to you.",
      "sheetSummary": "When a creature fails a save against one of your Mesmerism tricks, it has disadvantage on every attack roll and saving throw it makes until the end of its next turn.",
      "narration": "You open something in them and it stays open. Their swings come in half-committed and their mind will not close around anything, because part of it is still back in the room with your voice.",
      "meta": {
        "action": "Passive",
        "uses": "On any failed Mesmerism save",
        "range": "Your Mesmerism tricks"
      }
    },
    {
      "level": 3,
      "name": "Stage Hypnosis",
      "role": "roleplay",
      "description": "The old parlour act still works. Over 1 minute of uninterrupted talk with a willing or unsuspecting creature that can hear and understand you, you can put it into a light trance. While entranced it is calm, suggestible, and answers questions truthfully as it understands them, and it remembers the conversation afterwards as pleasant and unremarkable. The trance ends instantly if it is harmed, threatened, or asked to do something it would refuse while awake. This does no combat work and never functions on a creature already hostile to you.",
      "sheetSummary": "1 minute of uninterrupted talk with a willing or unsuspecting creature that can hear and understand you: it enters a light trance, answers truthfully as it understands things, and remembers the talk as unremarkable. Ends if harmed, threatened, or asked to do something it would refuse. Never works on an already-hostile creature; no combat use.",
      "narration": "Watch the coin. Listen to the voice. There is nothing frightening about any of it — that is the whole craft — and ten minutes later they walk away pleased with a conversation they cannot quite recount.",
      "meta": {
        "action": "1 minute",
        "range": "Conversation"
      }
    }
  ]
}
